{
  "id": "goethe",
  "name": "Goethe-Institut",
  "languageId": "german",
  "levels": {
    "A1": {
      "certificate": "Goethe-Zertifikat A1",
      "totalMinutes": 140,
      "modules": [
        {
          "id": "lesen",
          "title": "Leseverstehen",
          "minutes": 25,
          "parts": 2
        },
        {
          "id": "horen",
          "title": "Hörverstehen",
          "minutes": 40,
          "parts": 2
        },
        {
          "id": "grammatik",
          "title": "Grammatik / Wortschatz",
          "minutes": 0,
          "parts": 1
        },
        {
          "id": "schreiben",
          "title": "Schreiben",
          "minutes": 60,
          "parts": 1
        },
        {
          "id": "sprechen",
          "title": "Sprechen",
          "minutes": 15,
          "parts": 2
        }
      ],
      "taskTypes": {
        "lesen": [
          "short_text_mcq",
          "long_text_mcq"
        ],
        "horen": [
          "short_dialogue_mcq",
          "long_listening_mcq"
        ],
        "grammatik": [
          "grammar_mcq"
        ],
        "schreiben": [
          "writing_prompt"
        ],
        "sprechen": [
          "speaking_prompt"
        ]
      },
      "scoring": {
        "passPercent": 60,
        "perModule": true
      }
    },
    "A2": {
      "certificate": "Goethe-Zertifikat A2",
      "totalMinutes": 180,
      "modules": [
        {
          "id": "lesen",
          "title": "Leseverstehen",
          "minutes": 65,
          "parts": 2
        },
        {
          "id": "horen",
          "title": "Hörverstehen",
          "minutes": 40,
          "parts": 2
        },
        {
          "id": "grammatik",
          "title": "Grammatik / Wortschatz",
          "minutes": 0,
          "parts": 1
        },
        {
          "id": "schreiben",
          "title": "Schreiben",
          "minutes": 60,
          "parts": 1
        },
        {
          "id": "sprechen",
          "title": "Sprechen",
          "minutes": 15,
          "parts": 2
        }
      ],
      "taskTypes": {
        "lesen": [
          "short_text_mcq",
          "long_text_mcq"
        ],
        "horen": [
          "short_dialogue_mcq",
          "long_listening_mcq"
        ],
        "grammatik": [
          "grammar_mcq"
        ],
        "schreiben": [
          "writing_prompt"
        ],
        "sprechen": [
          "speaking_prompt"
        ]
      },
      "scoring": {
        "passPercent": 60,
        "perModule": true
      }
    },
    "B1": {
      "certificate": "Goethe-Zertifikat B1",
      "totalMinutes": 180,
      "modules": [
        {
          "id": "lesen",
          "title": "Leseverstehen",
          "minutes": 65,
          "parts": 5
        },
        {
          "id": "horen",
          "title": "Hörverstehen",
          "minutes": 40,
          "parts": 4
        },
        {
          "id": "schreiben",
          "title": "Schreiben",
          "minutes": 60,
          "parts": 3
        },
        {
          "id": "sprechen",
          "title": "Sprechen",
          "minutes": 15,
          "parts": 3
        }
      ],
      "taskTypes": {
        "lesen": [
          "richtig_falsch_texts",
          "mcq_texts",
          "matching",
          "opinion_yes_no",
          "multiple_choice_notice"
        ],
        "horen": [
          "short_texts_rf_mcq",
          "monologue_mcq",
          "informal_conversation_rf",
          "discussion_speaker_matching"
        ],
        "schreiben": [
          "writing_prompt"
        ],
        "sprechen": [
          "speaking_prompt"
        ]
      },
      "scoring": {
        "passPercent": 60,
        "perModule": true
      }
    },
    "B2": {
      "certificate": "Goethe-Zertifikat B2",
      "totalMinutes": 180,
      "modules": [
        {
          "id": "lesen",
          "title": "Leseverstehen",
          "minutes": 65,
          "parts": 5
        },
        {
          "id": "horen",
          "title": "Hörverstehen",
          "minutes": 40,
          "parts": 4
        },
        {
          "id": "grammatik",
          "title": "Grammatik / Wortschatz",
          "minutes": 0,
          "parts": 1
        },
        {
          "id": "schreiben",
          "title": "Schreiben",
          "minutes": 60,
          "parts": 3
        },
        {
          "id": "sprechen",
          "title": "Sprechen",
          "minutes": 15,
          "parts": 3
        }
      ],
      "taskTypes": {
        "lesen": [
          "long_text_mcq",
          "matching",
          "gap_article",
          "mcq_texts"
        ],
        "horen": [
          "short_dialogue_mcq",
          "short_monologues",
          "long_listening_mcq",
          "discussion"
        ],
        "grammatik": [
          "grammar_mcq"
        ],
        "schreiben": [
          "writing_prompt"
        ],
        "sprechen": [
          "speaking_prompt"
        ]
      },
      "scoring": {
        "passPercent": 60,
        "perModule": true
      }
    },
    "C1": {
      "certificate": "Goethe-Zertifikat C1",
      "totalMinutes": 180,
      "modules": [
        {
          "id": "lesen",
          "title": "Leseverstehen",
          "minutes": 65,
          "parts": 2
        },
        {
          "id": "horen",
          "title": "Hörverstehen",
          "minutes": 40,
          "parts": 2
        },
        {
          "id": "grammatik",
          "title": "Grammatik / Wortschatz",
          "minutes": 0,
          "parts": 1
        },
        {
          "id": "schreiben",
          "title": "Schreiben",
          "minutes": 60,
          "parts": 3
        },
        {
          "id": "sprechen",
          "title": "Sprechen",
          "minutes": 15,
          "parts": 3
        }
      ],
      "taskTypes": {
        "lesen": [
          "short_text_mcq",
          "long_text_mcq"
        ],
        "horen": [
          "short_dialogue_mcq",
          "long_listening_mcq"
        ],
        "grammatik": [
          "grammar_mcq"
        ],
        "schreiben": [
          "writing_prompt"
        ],
        "sprechen": [
          "speaking_prompt"
        ]
      },
      "scoring": {
        "passPercent": 60,
        "perModule": true
      }
    },
    "C2": {
      "certificate": "Goethe-Zertifikat C2",
      "totalMinutes": 180,
      "modules": [
        {
          "id": "lesen",
          "title": "Leseverstehen",
          "minutes": 65,
          "parts": 2
        },
        {
          "id": "horen",
          "title": "Hörverstehen",
          "minutes": 40,
          "parts": 2
        },
        {
          "id": "grammatik",
          "title": "Grammatik / Wortschatz",
          "minutes": 0,
          "parts": 1
        },
        {
          "id": "schreiben",
          "title": "Schreiben",
          "minutes": 60,
          "parts": 3
        },
        {
          "id": "sprechen",
          "title": "Sprechen",
          "minutes": 15,
          "parts": 3
        }
      ],
      "taskTypes": {
        "lesen": [
          "short_text_mcq",
          "long_text_mcq"
        ],
        "horen": [
          "short_dialogue_mcq",
          "long_listening_mcq"
        ],
        "grammatik": [
          "grammar_mcq"
        ],
        "schreiben": [
          "writing_prompt"
        ],
        "sprechen": [
          "speaking_prompt"
        ]
      },
      "scoring": {
        "passPercent": 60,
        "perModule": true
      }
    }
  }
}
